{
  "$schema_version": "1.0.0",
  "asset_name": "terminology-candidates",
  "domain": "news",
  "provenance": {
    "corpus_path": "Y:\\Linguistics\\News\\General\\Elaph",
    "n_articles_processed": 3801,
    "n_tokens_total": 2038127,
    "mining_elapsed_s": 25.3,
    "extraction_script": "scripts/mine_terminology.py",
    "min_freq_threshold": 5,
    "top_n_kept": 500
  },
  "notes": [
    "AR-side monolingual extraction. EN translations are NOT provided -- this is Phase 1.",
    "Phase 2 (downstream): propose EN translations per candidate and validate, then promote to corpus/domain-terminology.json.",
    "Top 50 candidates include sample_contexts (50-char windows). Others have empty contexts to keep file size manageable.",
    "Stop-word filtering applied; tashkeel stripped at tokenization time."
  ],
  "candidates": [
    {
      "term_ar": "الى",
      "freq": 11436,
      "ngram_size": "unigram",
      "sample_contexts": [
        "حمد عقباه ولن تسقط الانتخابات فحسب بل سيؤدي الامر الى سقوط الحكومة التي تعرضت ومنذ تشكلها لاكثر من هزة",
        "الأخلاق، اشاعة قيم واخلاق البعث من الرشوة والفساد الى حب جمع المال بأي طريقة وبأي اسلوب، اشاعة العنف وث",
        "من تجميع مجموعة المسلحين – منفذي العملية،وعددهم حوالى 40 شخصا- اضافة إلى نقل المتفجرات والأسلحة لموسكو"
      ]
    },
    {
      "term_ar": "العراق",
      "freq": 9401,
      "ngram_size": "unigram",
      "sample_contexts": [
        "الحدث في وقته واوانه. كما لايشك احد بجدية الحكومة العراقية للمضي قدما في العملية الديمقراطية التي تعد بها",
        "تأهيل حزب البعث! استولى بعث العراق على السلطة للمرة الأولى في انقلابه الأسود في 8 شب",
        "ة مناطق النفوذ السوفيتية لحساب الرأسمال الروسى فى العراق وسوريا وايران وجورجيا..الخ باعتبار أن هذه المناطق"
      ]
    },
    {
      "term_ar": "العراقي",
      "freq": 4109,
      "ngram_size": "unigram",
      "sample_contexts": [
        "الحدث في وقته واوانه. كما لايشك احد بجدية الحكومة العراقية للمضي قدما في العملية الديمقراطية التي تعد بها ك",
        "طريقة وبأي اسلوب، اشاعة العنف وثقافته في المجتمع العراقي ونشر فكر البداوة ومحاربة أي فكر مديني حضاري، وترك",
        "مع قوات التحرير الاميركية والقوات الوطنية للحكومة العراقية ورغم صراخ ونباح الاعلام الايراني الموجه بالعربي"
      ]
    },
    {
      "term_ar": "العربية",
      "freq": 4031,
      "ngram_size": "unigram",
      "sample_contexts": [
        "رة الدولة، وردد خلفه هذه المقولة امين عام الجامعة العربية، وهو الذي حصل فعلا من خلال تشكيلة الحكومة العراقي",
        "وفى هذا الاطار لابد من القول بأن العديد من الجهات العربية كانت تقف كمتفرج، بعبارة أخرى فى الوقت الذى أثار ا",
        "فهم ليس لهم لا وزن ولا قيمة في المعايير الدولية والعربية والإسلامية وتم تجزأت دول العالم مثل خطوط الطيران"
      ]
    },
    {
      "term_ar": "ولا",
      "freq": 3763,
      "ngram_size": "unigram",
      "sample_contexts": [
        "المانشيتات الصحفية، والفرقعات الاعلامية، والبروتوكولات الموقعة، والوعود المقطوعة، بخصوص اجراء الانتخابا",
        "الشيوعيين والقوى التقدمية من اذاعة تبث من الكويت. ولا ينسى احد مقولة امينهم القطري وقتذاك علي صالح السع",
        "بة بمحاسبة بوتين.لقد تعرض الكرملين لانتقادات حادة ولاساليبه فى حل أزمة مدرسة بيسلان التى اسفرت عن مقتل"
      ]
    },
    {
      "term_ar": "العراقية",
      "freq": 3404,
      "ngram_size": "unigram",
      "sample_contexts": [
        "الحدث في وقته واوانه. كما لايشك احد بجدية الحكومة العراقية للمضي قدما في العملية الديمقراطية التي تعد بها كل",
        "ترك خزينة الدولة خاوية لابل هناك ديون بذمة الدولة العراقية تقارب ( 200 مليار دولار ). ويلمس ذلك كل من يزور ا",
        "مع قوات التحرير الاميركية والقوات الوطنية للحكومة العراقية ورغم صراخ ونباح الاعلام الايراني الموجه بالعربي ل"
      ]
    },
    {
      "term_ar": "الشعب",
      "freq": 3286,
      "ngram_size": "unigram",
      "sample_contexts": [
        "لعراق بعد ان اخذوا معهم ما استطاعوا حمله من اموال الشعب العراقي، فهؤلاء لم يقرأوا الخارطة بشكل جيد، وتصور",
        "اء،ولعل هذه الأحداث الدامية تعلمنا أن حقوق ومصالح الشعب الشيشانى لم تعد لها آية صلة مع مجموعات باسايف،فى",
        "وطني) الزائف ضد الحكومة العراقية وضد حلفاء وأنصار الشعب العراقي.  من بين ادعاءاتهم الكاذبة والمنافقة أنهم"
      ]
    },
    {
      "term_ar": "ومن",
      "freq": 2925,
      "ngram_size": "unigram",
      "sample_contexts": [
        "يلوح في الافق من مقاطعة الانتخابات من جهات معروفة ومناطق محددة وربما تتوسع لتشمل مناطق اخرى مرشحة للانخ",
        "م صدام من اجل بناء الديمقراطية أو هي جادة في ذلك، ومن اجل سواد عيون العراقيين، لكنها فعلت ذلك لأن صدام",
        "خاطفين والتى تضمنت..سحب القوات الروسية من الشيشان،ومنح الشيشان استقلالها،اضافة لرفض الخاطفين لعرض السلط"
      ]
    },
    {
      "term_ar": "الله",
      "freq": 2792,
      "ngram_size": "unigram",
      "sample_contexts": [
        "مجتمع المدني واحزابنا الوطنية للتصدي لسياسة \" عفا الله عما سلف \" وليس للمجرمين الا حكم القانون.",
        "د والقبلات والأحضان وسياسة الإنكار والتضليل.  حمى الله مصر وترابها وشعبها الواحد يستظلهم علم الهلال والص",
        "امهم يتغيرون و حكامنا على صدورنا باقون الا من شاء الله أن يأخذه الي جواره.. لنرى كم رئيس وزراء تغير على"
      ]
    },
    {
      "term_ar": "العالم",
      "freq": 2743,
      "ngram_size": "unigram",
      "sample_contexts": [
        "زب النازي لا يزال الحظر ساري عليه منذ نهاية الحرب العالمية الثانية ولحد الآن، فكيف يتم السماح لحزب البعث ا",
        "لمعايير الدولية والعربية والإسلامية وتم تجزأت دول العالم مثل خطوط الطيران درجة أولى وثانية وسياحيه أي من ه",
        "فالة احترامها وتعزيزها وإتباعها.  إن وجود الإعلان العالمي لحقوق الإنسان (10/12/1948) والاتفاقية الدولية لل"
      ]
    },
    {
      "term_ar": "السياسية",
      "freq": 2735,
      "ngram_size": "unigram",
      "sample_contexts": [
        "( يعني حتى البعث الفاشي ) من المشاركة في العملية السياسية. والسيد رئيس الوزراء عاش لفترة طويلة في اوربا وهو",
        "ال التى تحدث فى روسيا؟ومن خلال نظرة سريعة للخريطة السياسية فى روسيا،سنجد أن الكرملين بقيادة بوتين حقق نجاحات",
        "ن (10/12/1948) والاتفاقية الدولية للحقوق المدنية والسياسية (1966) والاتفاقية الدولية للحقوق الاقتصادية والاج"
      ]
    },
    {
      "term_ar": "وهو",
      "freq": 2662,
      "ngram_size": "unigram",
      "sample_contexts": [
        "على مواقع هامة وحساسة في الدولة العراقية الجديدة وهو ما لا يروق للادارة الامريكية وحلفائها. وفي حال تن",
        "والقيادة القومية لبعث عفلق. ولعب ( وليم ليكلاند ) وهو مسؤول مركز المخابرات الأمريكية في العراق والذي كا",
        "لاد العربية،وترك الامر لجهاز الموساد ليعرض خدماته،وهو الحلقة المعادية للتعاون العربى- الروسى،وهو ايضا ا"
      ]
    },
    {
      "term_ar": "لها",
      "freq": 2590,
      "ngram_size": "unigram",
      "sample_contexts": [
        "عوية في مثل تلك الممارسات مهمة للغاية اذا ما اريد لها النجاح الساحق وليس نجاح 51%، الذي يعتمده اصحاب ال",
        "رتقى الى مستوى يمكنه من توفير أماكن آمنة لقياديه الهاربين للأقامة فيها. اما من هرب من البعثيين الى خارج",
        ".سحب القوات الروسية من الشيشان،ومنح الشيشان استقلالها،اضافة لرفض الخاطفين لعرض السلطات الأمنية بتوفير م"
      ]
    },
    {
      "term_ar": "الدول",
      "freq": 2512,
      "ngram_size": "unigram",
      "sample_contexts": [
        "ن دافعا قويا لها للتنافس على مواقع هامة وحساسة في الدولة العراقية الجديدة وهو ما لا يروق للادارة الامريكي",
        "كر البداوة ومحاربة أي فكر مديني حضاري، وترك خزينة الدولة خاوية لابل هناك ديون بذمة الدولة العراقية تقارب",
        "مية يعنى اعلان الحرب ضد روسيا من جانب قوى الارهاب الدولى،أكثر من هذا أعلن سيرجى ايفانوف وزير الدفاع الروس"
      ]
    },
    {
      "term_ar": "بها",
      "freq": 2471,
      "ngram_size": "unigram",
      "sample_contexts": [
        "عراقية للمضي قدما في العملية الديمقراطية التي تعد بها كل فئات ومكونات الطيف العراقي. لكن كيف يمكن للامم",
        "السيادة الى الحكومة العراقية ماهي الا بالونة يلهو بها الصغار، صحيح ان الحاكم \"بريمر\" غادر العراق، ولكن",
        "التعريب في كوردستان، في كركوك بالتحديد، التي ارتكبها نظام البعث المقبور لا تسقط بالتقادم الزمني. أما ك"
      ]
    },
    {
      "term_ar": "الدولة",
      "freq": 2423,
      "ngram_size": "unigram",
      "sample_contexts": [
        "ن دافعا قويا لها للتنافس على مواقع هامة وحساسة في الدولة العراقية الجديدة وهو ما لا يروق للادارة الامريكية",
        "كر البداوة ومحاربة أي فكر مديني حضاري، وترك خزينة الدولة خاوية لابل هناك ديون بذمة الدولة العراقية تقارب (",
        "والشيعة والتركمان و ( الوطنية،! )..  قانون ادارة الدولة العراقية في المرحلة الانتقالية ينص على أن العراق"
      ]
    },
    {
      "term_ar": "يوم",
      "freq": 2294,
      "ngram_size": "unigram",
      "sample_contexts": [
        "هم المشؤوم هذا في كتابه القيم ( عبدالكريم قاسم في يومه الأخير ). الوثائق والأعترافات التي ظهرت اسقطت ور",
        "يطرح هذا الفريق من المحللين تساؤلا حول ما اذا كان يوم الجمعة هو التوقيت الذى اختارته قوات الأمن،ام أنه",
        "8... ليس أصحاب الحق هم من يرفعون السلاح في عراق اليوم عراق الديموقراطية والقانون انما الارهابيون وأنصار"
      ]
    },
    {
      "term_ar": "وفي",
      "freq": 2290,
      "ngram_size": "unigram",
      "sample_contexts": [
        "الاعمال. فالاقبال الشديد على الانتخابات الموعودة وفي وقتها المحدد سلفا يعطي للحكومة فرصة لنيل ثقة المو",
        "البعث في الآونة الأخيرة ارتقى الى مستوى يمكنه من توفير أماكن آمنة لقياديه الهاربين للأقامة فيها. اما من",
        "مازال الجدل يدور حول ملابسات عملية اقتحام المدرسة،وفيما تؤكد الرواية الرسمية أن عناصر فرق الانقاذ قد تو"
      ]
    },
    {
      "term_ar": "الحكومة",
      "freq": 2286,
      "ngram_size": "unigram",
      "sample_contexts": [
        "الانتخابات الموعودة: قدرة الحكومة والتحديات! اذا ما صحت التوصيفات الحكومية، والمانش",
        "، وغيرها الكثير )، ناهيك عن المدن الخارجة عن سلطة الحكومة العراقية المؤقتة وهي معروفة للجميع. واخذ المراقبو",
        "حتى أن الخاطفين لم يمهلوا المجتمع الدولي ولا حتى الحكومة النيبالية مهلة للتفاوض بينما الفرنسيين والإيطاليت"
      ]
    },
    {
      "term_ar": "العربي",
      "freq": 2170,
      "ngram_size": "unigram",
      "sample_contexts": [